<?xml version="1.0" encoding="UTF-8"?>
<!DOCTYPE employees SYSTEM "Employee.dtd">
<employees>
	<employee eid="E1" lang="Java">
		<id>101</id>
		<firstName>bill</firstName>
		<lastName>andrew</lastName>
	</employee>

	<employee eid="E2" lang="Python">
		<id>102</id>
		<firstName>bill</firstName>
		<lastName>
			ray</lastName>
	</employee>

</employees>